jurisdiction,name,institution,year,url,last_accessed,citation_key
multi,WB Carbon Pricing Dashboard,World Bank,2020,https://carbonpricingdashboard.worldbank.org/,2021,WBCPD
multi,WB Carbon Pricing Dashboard,World Bank,2022,https://carbonpricingdashboard.worldbank.org/,2022,WBCPD
multi,Allowance Price Explorer,International Carbon Action Partnership,2021,https://icapcarbonaction.com/en/ets-prices,2021,ICAP-ETS
multi,RGGI Auction Results,"RGGI, Inc.",2021,https://www.rggi.org/auctions/auction-results,2021,RGGI
Australia,Liable Entities Public Information Database,Clean Energy Regulator,2015,http://www.cleanenergyregulator.gov.au/Infohub/CPM/Liable-Entities-Public-Information-Database,2021,AU-CER-LEPID
European Union,Taxes in Europe Database,,,https://ec.europa.eu/taxation_customs/tedb/taxSearch.html,2022,EC